{
    "id": "http://sport-archive.com/input-schema#",
    "$schema": "http://json-schema.org/draft-04/schema#",
    "title": "Schema for ValidateInputAndAsset activity task",
    "type": "object",
    "properties": {
        "api_key": {
            "description": "API for your Cloud Transcode account",
            "type": "string"
        },
        "input_type": {
            "enum": [ "VIDEO", "AUDIO", "IMG", "DOC" ],
            "description": "Type of the input file to transcode: VIDEO, AUDIO, DOC, IMG",
            "type": "string"
        },
        "input_bucket": {
            "description": "S3 bucket where the file is located",
            "type": "string"
        },
        "input_file": {
            "description": "Path to the file to process",
            "type": "string"
        },
        "job_label": {
            "description": "Name to your job",
            "type": "string"
        },
        "outputs": {
            "description": "List of all the outputs needed for that job array of max 100 entries",
            "type": "array",
            "items": {
                "$ref": "output/base.json",
                "oneOf": [                    
                    { "$ref": "output/video.json" },
		    { "$ref": "output/thumb.json" }
                ]
            },
            "minItems": 1,
            "uniqueItems": true
        }
    },
    "required": ["api_key", "input_type", "input_bucket", "input_file", "outputs"],
    "additionalProperties": true
}
