{
    "api_key": "1234567890abcdefghijkl",
    "input_type": "VIDEO",
    "input_bucket": "ct-my-bucket-in",
    "input_file": "/input2/test2.mp4",
    "job_label": "test2 transcode",
    "outputs": 
    [
	{
	    "output_type": "VIDEO",
	    "output_label": "SD smartphone test2 output",
	    "output_bucket": "ct-my-bucket-out",
	    "output_file": "/output2/test2_sd_phone.mp4",
	    "s3_rrs": true,
	    "s3_encrypt": false,
	    "preset": "480p-16.9-generic",
	    "no_enlarge": false,
	    "watermark": {
		"input_bucket": "ct-my-bucket-in",
		"input_file": "/watermark/logo_SA.png",
		"size": "75.2x28.4",
		"opacity": 2,
		"x": 20,
		"y": 20
	    }
	},
	{
	    "output_type": "VIDEO",
	    "output_label": "HD smartphone test2 output",
	    "output_bucket": "ct-my-bucket-out",
	    "output_file": "/output2/test2_hd_phone.mp4",
	    "s3_rrs": false,
	    "s3_encrypt": true,
	    "preset": "1080p-generic",
	    "no_enlarge": false,
	    "watermark": {
		"input_bucket": "ct-my-bucket-in",
		"input_file": "/watermark/logo_SA.png",
		"size": "75.2x28.4",
		"opacity": 2,
		"x": 20,
		"y": 20
	    }
	},
	{
	    "output_type": "THUMB",
	    "mode": "intervals",
	    "output_bucket": "ct-my-bucket-out",
	    "output_file": "/output2/thumbs/test2_thumb.jpg",
	    "s3_rrs": true,
	    "size": "160x120",
	    "intervals": 5
	}
    ]
}
